{
  "id": "task-context-control-plane",
  "revision": 4,
  "threadRef": "codex://task/current",
  "assertions": [
    {
      "id": "assertion-objective",
      "kind": "objective",
      "text": "Resolver의 데이터 계약과 핵심 화면을 구현 가능한 수준으로 만든다.",
      "epistemicStatus": "adopted",
      "sourceRefs": ["event-20260827-001"]
    },
    {
      "id": "assertion-prototype-scope",
      "kind": "constraint",
      "text": "실제 개인 지침을 변경하지 않고 대표 데이터로 프로토타입을 만든다.",
      "epistemicStatus": "inferred",
      "sourceRefs": ["event-20260827-001", "task://context-control-plane?revision=3"],
      "impact": "low",
      "reversible": true
    },
    {
      "id": "assertion-success",
      "kind": "success_criterion",
      "text": "현재 요청과 이 작업에 필요한 기준을 한 화면에서 확인할 수 있다.",
      "epistemicStatus": "adopted",
      "sourceRefs": ["task://context-control-plane?revision=3"]
    }
  ],
  "requestEventRefs": ["event-20260827-001"],
  "status": "ready",
  "createdAt": "2026-08-27T10:50:00Z",
  "updatedAt": "2026-08-27T10:51:00Z"
}
